{
  "run": {
    "target_url": "http://localhost:3000",
    "task_list": "test/fixtures/tasks.json",
    "personas": ["free-tier-user", "willing-to-pay-user", "vp-team-buyer"]
  },
  "run_status": "BLOCKED",
  "personas": [
    { "name": "free-tier-user", "run_status": "completed" },
    { "name": "willing-to-pay-user", "run_status": "crashed" },
    { "name": "vp-team-buyer", "run_status": "completed" }
  ],
  "validity_envelope_text": "This report is not a replacement for real user research. It contains no willingness-to-pay estimates. It contains no population percentage extrapolations. It makes no ISO 9241-11 compliance claim. 1 of 3 personas did not complete: willing-to-pay-user.",
  "findings": [
    {
      "id": "fr-001",
      "finding_id": "fid-signup-cta-hidden",
      "friction_name": "signup CTA hidden below the fold on the pricing page",
      "friction_type": "walkthrough_failure",
      "step": 2,
      "personas_flagging": ["free-tier-user", "willing-to-pay-user"],
      "convergence_tier": 2,
      "heuristic_tag": "visibility-of-system-status",
      "severity": 3,
      "severity_factors": { "frequency": "every first visit", "impact": "user scrolls and hunts", "persistence": "recurs until learned" },
      "market_impact": true,
      "evidence": [{ "type": "screenshot", "path": "runs/fixture/step2-free-tier.png" }],
      "narrative": "The persona could not locate the primary CTA without scrolling; two extra scroll actions were needed.",
      "timestamp": "2026-07-08T10:00:00Z"
    },
    {
      "id": "fr-002",
      "finding_id": "fid-plan-names-ambiguous",
      "friction_name": "plan names do not state what happens after the trial",
      "friction_type": "ambiguity_resolution",
      "step": 3,
      "concurrent_candidates": 2,
      "personas_flagging": ["vp-team-buyer"],
      "convergence_tier": 1,
      "heuristic_tag": "match-system-real-world",
      "severity": 2,
      "severity_factors": { "frequency": "each pricing review", "impact": "persona re-reads plan copy twice", "persistence": "recurs" },
      "market_impact": false,
      "evidence": [{ "type": "dom", "path": "runs/fixture/step3-pricing.html" }],
      "narrative": "The buyer persona had to open the FAQ to resolve what 'flexible billing' means.",
      "timestamp": "2026-07-08T10:00:00Z"
    }
  ]
}
